<?xml version="1.0" encoding="UTF-8"?>
<schema xmlns="http://www.w3.org/2001/XMLSchema" targetNamespace="http://www.ambimmort.com/msg_0x85"
	xmlns:xs="http://www.w3.org/2001/XMLSchema" xmlns:u="http://www.ambimmort.com/UType"
	xmlns:tns="http://www.ambimmort.com/msg_0x85" elementFormDefault="qualified">
	<import namespace="http://www.ambimmort.com/UType" schemaLocation="UType.xsd">
	</import>

	<xs:element name="Type_0x85">
		<xs:annotation>
			<xs:documentation xml:lang="zh">
				用户/应用策略信息下发
			</xs:documentation>
		</xs:annotation>
		<xs:complexType>
			<xs:complexContent>
				<xs:extension base="u:Type_UcMessage">
					<xs:sequence>
						<xs:element name="Bind_Action" type="u:UINT1"
							maxOccurs="1" minOccurs="1"></xs:element>
						<xs:element name="UserType" type="u:UINT1" maxOccurs="1"
							minOccurs="1"></xs:element>
						<xs:element name="UserName" type="string" maxOccurs="1"
							minOccurs="1"></xs:element>
						<xs:element name="Messages">
							<xs:annotation>
								<xs:documentation xml:lang="zh">
									本用户待绑定的策略数，Messages的子元素个数对应MessageNum 字段，2 Bytes
								</xs:documentation>
							</xs:annotation>
							<xs:complexType>
								<xs:sequence>
									<xs:element name="Message" maxOccurs="unbounded"
										minOccurs="0">
										<xs:complexType>
											<xs:sequence>
												<xs:element name="MessageType" type="u:UINT1"
													maxOccurs="1" minOccurs="1">
												</xs:element>
												<xs:element name="MessageNo" type="u:UINT2"
													maxOccurs="1" minOccurs="1">
												</xs:element>
											</xs:sequence>
										</xs:complexType>
									</xs:element>
								</xs:sequence>
							</xs:complexType>
						</xs:element>
					</xs:sequence>
				</xs:extension>
			</xs:complexContent>
		</xs:complexType>
	</xs:element>
</schema>