<?xml version="1.0" encoding="UTF-8"?>
<Type_0x85 messageNo="0" messageSequenceNo="0"
	messageSerialNo="0" xmlns="http://www.ambimmort.com/msg_0x85" xmlns:u="http://www.ambimmort.com/UType"
	xmlns:xsi="http://www.w3.org/2001/XMLSchema-instance"
	xsi:schemaLocation="http://www.ambimmort.com/msg_0x85 msg_0x85.xsd ">
	<Bind_Action>1</Bind_Action>
	<UserType>1</UserType>
	<UserName>abc</UserName>
	<Messages>
		<Message>
			<MessageType>1</MessageType>
			<MessageNo>1</MessageNo>
		</Message>
		<Message>
			<MessageType>1</MessageType>
			<MessageNo>1</MessageNo>
		</Message>
	</Messages>
</Type_0x85>
